{
  "$schema": "http://json-schema.org/draft-04/schema",
  "title": "JSON Schema for flow configurations",

  "type": "object",

  "properties": {
    "Name": {
      "type": "string",
      "description": "Represents the name of the flow."
    },
    "ActionClassIdentifier": {
      "type": "string",
      "description": "Action class fully qualified identifier."
    },
    "RequestIdentifier": {
      "type": "string",
      "description": "Request Type fully qualified identifier."
    },
    "ResponseIdentifier": {
      "type": "string",
      "description": "Response Type fully qualified identifier."
    },
    "Validations": {
      "type": "array",
      "description": "Array of validations",
      "items": {
        "$ref": "#/definitions/validation"
      }

    }
  },
  "definitions": {
    "validation": {
      "type": "object",
      "description": "Validation",
      "required": [ "requestProperties", "errorResource", "serverValidator" ],
      "properties": {
        "errorResource": {
          "type": "string"
        },
        "serverValidator": {
          "type": "string",
          "enum": [
            "JMovies.Utilities.Validations.RequiredValidator, JMovies.Utilities",
            "JMovies.Utilities.Validations.PasswordRulesValidator, JMovies.Utilities",
            "JMovies.Utilities.Validations.EqualsValidator, JMovies.Utilities",
            "JMovies.Utilities.Validations.UsernameRulesValidator, JMovies.Utilities",
            "JMovies.App.Business.Validations.UsernameRulesValidator, JMovies.App.Business",
            "JMovies.App.Business.Validations.EmailExistsValidator, JMovies.App.Business",
            "JMovies.Utilities.Validations.RegexValidator, JMovies.Utilities"
          ]
        },
        "requestProperties": {
          "type": "array",
          "description": "Array of request properties",
          "items": {
            "type": "string"
          }
        }
      }
    }
  }
}