{
  "$schema": "../../JMovies.App/ConfigurationFiles/schemas/flowconfiguration-schema.json#",
  "Name": "Login",
  "RequestIdentifier": "JMovies.Entities.Requests.LoginRequest, JMovies.Entities",
  "ResponseIdentifier": "JMovies.Entities.Responses.LoginResponse, JMovies.Entities",
  "ActionClassIdentifier": "JMovies.App.Business.Actions.Login, JMovies.App.Business"
}