{
  "$schema": "../../JMovies.App/ConfigurationFiles/schemas/flowconfiguration-schema.json#",
  "Name": "GetLastAddedProductions",
  "RequestIdentifier": "JMovies.Entities.Requests.GetLastAddedProductionsRequest, JMovies.Entities",
  "ResponseIdentifier": "JMovies.Entities.Responses.GetLastAddedProductionsResponse, JMovies.Entities",
  "ActionClassIdentifier": "JMovies.App.Business.Actions.GetLastAddedProductions, JMovies.App.Business"
}