{
  "$schema": "../../JMovies.App/ConfigurationFiles/schemas/flowconfiguration-schema.json#",
  "Name": "BasicResolutionTest",
  "RequestIdentifier": "JMovies.Entities.Requests.BasicResolutionTestRequest, JMovies.Entities",
  "ResponseIdentifier": "JMovies.Entities.Responses.BasicResolutionTestResponse, JMovies.Entities",
  "ActionClassIdentifier": "JMovies.App.Business.Actions.BasicResolutionTest, JMovies.App.Business"
}